{
  "version": "recast_benchmark_report.v1",
  "suite_id": "recast-regression-smoke",
  "generated_at": "2026-02-17T00:35:00Z",
  "cases": [
    {
      "case_id": "baseline-worker-output",
      "job_id": "mochi-dino-replace-smoke-20240515",
      "report_path": "sandbox/logs/benchmarks/recast-regression-smoke/baseline-worker-output.recast_quality_report.v1.json",
      "overall_score": 0.66,
      "overall_pass": false,
      "failed_metrics": [
        "identity_consistency"
      ]
    },
    {
      "case_id": "hitl-viggle-output",
      "job_id": "mochi-dino-replace-smoke-20240515",
      "report_path": "sandbox/logs/benchmarks/recast-regression-smoke/hitl-viggle-output.recast_quality_report.v1.json",
      "overall_score": 0.71,
      "overall_pass": false,
      "failed_metrics": [
        "mask_edge_bleed"
      ]
    }
  ],
  "summary": {
    "case_count": 2,
    "pass_count": 0,
    "avg_overall_score": 0.685,
    "all_pass": false
  }
}

